{
    "experiment_id": "test",
    "flag_original_metrics": true,
    "flag_debug_params": true,
    "max_throughput_mbps": 100,
    "polling_interval": 5,
    "requests_timeout": 1,
    "multiplier": 2000,
    "routers": [
        {
            "r1": {
                "collector_url": "http://node-exporter-collector-service:8000/metrics/r1_9100.json",
                "topic": "TD_r1",
                "interfaces": ["eth2", "eth4"],
                "test_metrics": false
            }
        },
        {
            "r2": {
                "collector_url": "http://node-exporter-collector-service:8000/metrics/r2_9100.json",
                "topic": "TD_r2",
                "interfaces": ["eth1", "eth2"],
                "test_metrics": false
            }
        },
        {
            "r3": {
                "collector_url": "http://node-exporter-collector-service:8000/metrics/r3_9100.json",
                "topic": "TD_r3",
                "interfaces": ["eth3"],
                "test_metrics": false
            }
        },
        {
            "r4": {
                "collector_url": "http://node-exporter-collector-service:8000/metrics/r4_9100.json",
                "topic": "TD_r4",
                "interfaces": ["eth1"],
                "test_metrics": false
            }
        },
        {
            "r5": {
                "collector_url": "http://node-exporter-collector-service:8000/metrics/r5_9100.json",
                "topic": "TD_r5",
                "interfaces": ["eth1"],
                "test_metrics": false
            }
        },
        {
            "r6": {
                "collector_url": "http://node-exporter-collector-service:8000/metrics/r6_9100.json",
                "topic": "TD_r6",
                "interfaces": ["eth1","eth2"],
                "test_metrics": false
            }
        },
        {
            "r7": {
                "collector_url": "http://node-exporter-collector-service:8000/metrics/r7_9100.json",
                "topic": "TD_r7",
                "interfaces": ["eth2"],
                "test_metrics": false
            }
        },
        {
            "r8": {
                "collector_url": "http://node-exporter-collector-service:8000/metrics/r8_9100.json",
                "topic": "TD_r8",
                "interfaces": ["eth2","eth3"],
                "test_metrics": false
            }
        },
        {
            "r9": {
                "collector_url": "http://node-exporter-collector-service:8000/metrics/r9_9100.json",
                "topic": "TD_r9",
                "interfaces": ["eth2","eth3"],
                "test_metrics": false
            }
        },
        {
            "ru": {
                "collector_url": "http://node-exporter-collector-service:8000/metrics/ru_9100.json",
                "topic": "TD_ru",
                "interfaces": ["eth1"],
                "test_metrics": false
            }
        },
        {
            "rg": {
                "collector_url": "http://node-exporter-collector-service:8000/metrics/rg_9100.json",
                "topic": "TD_rg",
                "interfaces": ["eth2","eth3"],
                "test_metrics": false
            }
        }
    ]
}